{
  "name": "aws-resources-operations",
  "display_name": "AWS Resources MCP Server",
  "description": "Run generated python code to securely query or modify any AWS resources supported by boto3.",
  "repository": {
    "type": "git",
    "url": "https://github.com/baryhuang/mcp-server-aws-resources-python"
  },
  "homepage": "https://github.com/baryhuang/mcp-server-aws-resources-python",
  "author": {
    "name": "baryhuang"
  },
  "license": "MIT",
  "categories": [
    "AWS",
    "Docker"
  ],
  "tags": [
    "AWS",
    "Docker",
    "boto3"
  ],
  "installations": {
    "docker": {
      "type": "docker",
      "command": "docker",
      "args": [
        "run",
        "-i",
        "--rm",
        "-e",
        "AWS_ACCESS_KEY_ID=${AWS_ACCESS_KEY_ID}",
        "-e",
        "AWS_SECRET_ACCESS_KEY=${AWS_SECRET_ACCESS_KEY}",
        "-e",
        "AWS_DEFAULT_REGION=${AWS_DEFAULT_REGION}",
        "buryhuang/mcp-server-aws-resources:latest"
      ]
    }
  }
}